{
  "$schema": "../../schema/official-source-catalog.schema.json",
  "catalogVersion": "2026-07-11",
  "sourceCount": 38,
  "downloadEndpoint": "https://ncic.re.kr/srch/download.do",
  "sessionPage": "https://ncic.re.kr/srch/result_more.do?cate=attach&order=desc&page=1&search=2022%EA%B0%9C%EC%A0%95&sort=date",
  "sources": [
    {"id":"kr-nec-2026-1-annex1","annex":1,"profileScopes":["middle","high"],"filePath":"/data/uploads/ncicinvFile/org/","storedName":"9e4c7fb8-ba83-484d-a6cd-43ec765d784d.pdf","originalName":"(2022 개정) 초·중등학교 교육과정 [별책1] 총론_ 국가교육위원회 고시 제2026-1호(2026.1.21.).pdf","attachmentNo":"10004184","governingNotice":"국가교육위원회 고시 제2026-1호","selectionReason":"2026-1호가 총론을 개정함"},
    {"id":"kr-nec-2026-1-annex3","annex":3,"profileScopes":["middle"],"filePath":"/data/uploads/ncicinvFile/org/","storedName":"7863b399-a384-4fa7-a8c7-7290007a2674.pdf","originalName":"(2022 개정) 초·중등학교 교육과정 [별책3] 중학교_ 국가교육위원회 고시 제2026-1호(2026.1.21.).pdf","attachmentNo":"10004186","governingNotice":"국가교육위원회 고시 제2026-1호","selectionReason":"2026-1호가 중학교 교육과정을 개정함"},
    {"id":"kr-nec-2026-1-annex4","annex":4,"profileScopes":["high"],"filePath":"/data/uploads/ncicinvFile/org/","storedName":"e8d6fec2-6f25-489a-bdf6-6257e0b4e949.pdf","originalName":"(2022 개정) 초·중등학교 교육과정 [별책4] 고등학교_ 국가교육위원회 제2026-1호(2026.1.21.).pdf","attachmentNo":"10004190","governingNotice":"국가교육위원회 고시 제2026-1호","selectionReason":"2026-1호가 고등학교 교육과정을 개정함"},
    {"id":"kr-moe-2022-33-annex5","annex":5,"profileScopes":["middle","high"],"filePath":"/data/uploads/ncicinvFile/org/","storedName":"20221222102328115.pdf","originalName":"[별책5] 국어과 교육과정.pdf","attachmentNo":"10003553","governingNotice":"교육부 고시 제2022-33호","selectionReason":"후속 고시에서 대체되지 않은 국어과 기준선"},
    {"id":"kr-moe-2022-33-annex6","annex":6,"profileScopes":["middle","high"],"filePath":"/data/uploads/ncicinvFile/org/","storedName":"20230206103210673.pdf","originalName":"[별책6] 도덕과 교육과정.pdf","attachmentNo":"10003738","governingNotice":"교육부 고시 제2022-33호","selectionReason":"후속 고시에서 대체되지 않은 도덕과 기준선"},
    {"id":"kr-nec-2024-3-annex7","annex":7,"profileScopes":["middle","high"],"filePath":"/data/uploads/ncicinvFile/org/","storedName":"20240820045255243.pdf","originalName":"(2022개정) 초·중등학교 교육과정 [별책7] 사회과_ 국가교육위원회 고시 제2024-3호(2024.08.16.).pdf","attachmentNo":"10003993","governingNotice":"국가교육위원회 고시 제2024-3호","selectionReason":"2024-3호 재발행 사회과 기준선"},
    {"id":"kr-moe-2022-33-annex8","annex":8,"profileScopes":["middle","high"],"filePath":"/data/uploads/ncicinvFile/org/","storedName":"20221222102408052.pdf","originalName":"[별책8] 수학과 교육과정.pdf","attachmentNo":"10003559","governingNotice":"교육부 고시 제2022-33호","selectionReason":"후속 고시에서 대체되지 않은 수학과 기준선"},
    {"id":"kr-nec-2024-3-annex9","annex":9,"profileScopes":["middle","high"],"filePath":"/data/uploads/nciccurriculum/","storedName":"20250820020007575.pdf","originalName":"[별책9] 과학과 교육과정.pdf","attachmentNo":"10004171","governingNotice":"국가교육위원회 고시 제2024-3호","selectionReason":"NCIC가 2025년에 교체 게시한 2024-3호 과학과 파일"},
    {"id":"kr-moe-2022-33-annex10","annex":10,"profileScopes":["middle","high"],"filePath":"/data/uploads/ncicinvFile/org/","storedName":"20230508011148486.pdf","originalName":"[별책10] 실과(기술가정)정보과 교육과정.pdf","attachmentNo":"10003781","governingNotice":"교육부 고시 제2022-33호","selectionReason":"후속 고시에서 대체되지 않은 기술·가정/정보 기준선"},
    {"id":"kr-moe-2022-33-annex11","annex":11,"profileScopes":["middle","high"],"filePath":"/data/uploads/ncicinvFile/org/","storedName":"20221226101447312.pdf","originalName":"[별책11] 체육과 교육과정.pdf","attachmentNo":"10003695","governingNotice":"교육부 고시 제2022-33호","selectionReason":"후속 고시에서 대체되지 않은 체육과 기준선"},
    {"id":"kr-nec-2024-3-annex12","annex":12,"profileScopes":["middle","high"],"filePath":"/data/uploads/ncicinvFile/org/","storedName":"20240820045510487.pdf","originalName":"(2022개정) 초·중등학교 교육과정 [별책12] 음악과_ 국가교육위원회 고시 제2024-3호(2024.08.16.).pdf","attachmentNo":"10003999","governingNotice":"국가교육위원회 고시 제2024-3호","selectionReason":"2024-3호 재발행 음악과 기준선"},
    {"id":"kr-moe-2022-33-annex13","annex":13,"profileScopes":["middle","high"],"filePath":"/data/uploads/ncicinvFile/org/","storedName":"20221222102342456.pdf","originalName":"[별책13] 미술과 교육과정.pdf","attachmentNo":"10003555","governingNotice":"교육부 고시 제2022-33호","selectionReason":"후속 고시에서 대체되지 않은 미술과 기준선"},
    {"id":"kr-nec-2024-3-annex14","annex":14,"profileScopes":["middle","high"],"filePath":"/data/uploads/ncicinvFile/org/","storedName":"20240821010057327.pdf","originalName":"(2022개정)초·중등학교교육과정[별책14]영어과_국가교육위원회고시제2024-3호(2024.08.16.).pdf","attachmentNo":"10004085","governingNotice":"국가교육위원회 고시 제2024-3호","selectionReason":"2024-3호 재발행 영어과 기준선"},
    {"id":"kr-moe-2022-33-annex16","annex":16,"profileScopes":["middle","high"],"filePath":"/data/uploads/ncicinvFile/org/","storedName":"20230310030222367.pdf","originalName":"[별책16] 제2외국어과 교육과정.pdf","attachmentNo":"10003762","governingNotice":"교육부 고시 제2022-33호","selectionReason":"후속 고시에서 대체되지 않은 제2외국어과 기준선"},
    {"id":"kr-moe-2022-33-annex17","annex":17,"profileScopes":["middle","high"],"filePath":"/data/uploads/ncicinvFile/org/","storedName":"20230206021553274.pdf","originalName":"[별책17] 한문과 교육과정.pdf","attachmentNo":"10003750","governingNotice":"교육부 고시 제2022-33호","selectionReason":"후속 고시에서 대체되지 않은 한문과 기준선"},
    {"id":"kr-nec-2024-3-annex18","annex":18,"profileScopes":["middle"],"filePath":"/data/uploads/ncicinvFile/org/","storedName":"20240820050741256.pdf","originalName":"(2022개정) 초·중등학교 교육과정 [별책18] 중학교 선택교과_국가교육위원회 고시 제2024-3호(2024.08.16.).pdf","attachmentNo":"10004037","governingNotice":"국가교육위원회 고시 제2024-3호","selectionReason":"현행 중학교 선택 교과 기준선"},
    {"id":"kr-nec-2024-3-annex19","annex":19,"profileScopes":["high"],"filePath":"/data/uploads/ncicinvFile/org/","storedName":"20240820045143716.pdf","originalName":"(2022개정) 초·중등학교 교육과정 [별책19] 고등학교 교양 교과_국가교육위원회 고시 제2024-3호(2024.08.16.).pdf","attachmentNo":"10003991","governingNotice":"국가교육위원회 고시 제2024-3호","selectionReason":"현행 고등학교 교양 교과 기준선"},
    {"id":"kr-moe-2022-33-annex20","annex":20,"profileScopes":["high"],"filePath":"/data/uploads/ncicinvFile/org/","storedName":"20221222104036806.pdf","originalName":"[별책20] 과학 계열 선택 과목 교육과정.pdf","attachmentNo":"10003683","governingNotice":"교육부 고시 제2022-33호","selectionReason":"후속 고시에서 대체되지 않은 과학 계열 선택 기준선"},
    {"id":"kr-moe-2022-33-annex21","annex":21,"profileScopes":["high"],"filePath":"/data/uploads/ncicinvFile/org/","storedName":"20221222104048927.pdf","originalName":"[별책21] 체육 계열 선택 과목 교육과정.pdf","attachmentNo":"10003685","governingNotice":"교육부 고시 제2022-33호","selectionReason":"후속 고시에서 대체되지 않은 체육 계열 선택 기준선"},
    {"id":"kr-nec-2024-3-annex22","annex":22,"profileScopes":["high"],"filePath":"/data/uploads/ncicinvFile/org/","storedName":"20240820045428751.pdf","originalName":"(2022개정) 초·중등학교 교육과정 [별책22] 예술계열 선택 과목_국가교육위원회 고시 제2024-3호(2024.08.16.).pdf","attachmentNo":"10003997","governingNotice":"국가교육위원회 고시 제2024-3호","selectionReason":"현행 예술 계열 선택 기준선"},
    {"id":"kr-nec-2024-3-annex23","annex":23,"profileScopes":["high"],"filePath":"/data/uploads/ncicinvFile/org/","storedName":"20241023024830811.pdf","originalName":"(2022개정)초·중등학교교육과정[별책23]경영·금융전문교과__국가교육위원회고시제2024-3호(2024.08.16.).pdf","attachmentNo":"10004130","governingNotice":"국가교육위원회 고시 제2024-3호","selectionReason":"현행 경영·금융 전문 교과 기준선"},
    {"id":"kr-nec-2024-3-annex24","annex":24,"profileScopes":["high"],"filePath":"/data/uploads/ncicinvFile/org/","storedName":"20241023024915497.pdf","originalName":"(2022개정)초·중등학교교육과정[별책24]보건·복지전문교과_국가교육위원회고시제2024-3호(2024.08.16.).pdf","attachmentNo":"10004132","governingNotice":"국가교육위원회 고시 제2024-3호","selectionReason":"현행 보건·복지 전문 교과 기준선"},
    {"id":"kr-nec-2024-3-annex25","annex":25,"profileScopes":["high"],"filePath":"/data/uploads/ncicinvFile/org/","storedName":"20240826080919212.pdf","originalName":"(2022개정)초·중등학교교육과정[별책25]문화·예술·디자인·방송전문교과_국가교육위원회고시제2024-3호(2024.08.16.).pdf","attachmentNo":"10004094","governingNotice":"국가교육위원회 고시 제2024-3호","selectionReason":"현행 문화·예술·디자인·방송 전문 교과 기준선"},
    {"id":"kr-nec-2024-3-annex26","annex":26,"profileScopes":["high"],"filePath":"/data/uploads/ncicinvFile/org/","storedName":"20240826080934572.pdf","originalName":"(2022개정)초·중등학교교육과정[별책26]미용전문교과_국가교육위원회고시제2024-3호(2024.08.16.).pdf","attachmentNo":"10004096","governingNotice":"국가교육위원회 고시 제2024-3호","selectionReason":"현행 미용 전문 교과 기준선"},
    {"id":"kr-nec-2024-3-annex27","annex":27,"profileScopes":["high"],"filePath":"/data/uploads/ncicinvFile/org/","storedName":"20240826081029412.pdf","originalName":"(2022개정)초·중등학교 교육과정[별책27] 관광·레저 전문 교과_국가교육위원회 고시 제2024-3호(2024.8.16.).pdf","attachmentNo":"10004098","governingNotice":"국가교육위원회 고시 제2024-3호","selectionReason":"현행 관광·레저 전문 교과 기준선"},
    {"id":"kr-nec-2024-3-annex28","annex":28,"profileScopes":["high"],"filePath":"/data/uploads/ncicinvFile/org/","storedName":"20240826081059047.pdf","originalName":"(2022개정)초·중등학교교육과정[별책28]식품·조리전문교과_국가교육위원회고시제2024-3호(2024.08.16.).pdf","attachmentNo":"10004100","governingNotice":"국가교육위원회 고시 제2024-3호","selectionReason":"현행 식품·조리 전문 교과 기준선"},
    {"id":"kr-nec-2024-3-annex29","annex":29,"profileScopes":["high"],"filePath":"/data/uploads/ncicinvFile/org/","storedName":"20240826081127100.pdf","originalName":"(2022개정)초·중등학교교육과정[별책29]건축·토목전문교과_국가교육위원회고시제2024-3호(2024.08.16.).pdf","attachmentNo":"10004102","governingNotice":"국가교육위원회 고시 제2024-3호","selectionReason":"현행 건축·토목 전문 교과 기준선"},
    {"id":"kr-nec-2024-3-annex30","annex":30,"profileScopes":["high"],"filePath":"/data/uploads/ncicinvFile/org/","storedName":"20240826081149960.pdf","originalName":"(2022개정)초·중등학교교육과정[별책30]기계전문교과_국가교육위원회고시제2024-3호(2024.08.16.).pdf","attachmentNo":"10004104","governingNotice":"국가교육위원회 고시 제2024-3호","selectionReason":"현행 기계 전문 교과 기준선"},